{
  "$schema": "codegen-settings.schema.json",
  "namespace": "Test.Client",
  "useInterface": false,
  "constructorSettings": {
    "OmittedConstructorController": {
      "omit": true
    },
    "CustomJsonSettingsController": {
      "customJsonSettings": "MyCustomJsonSettings.Options"
    }
  },
  "controllerFilters": [
    {
      "exclude": "^Test\\.WebApi\\.Controllers\\.(AbsUrl)?RedirectTestController$"
    },
    {
      "exclude": "FilteredController$"
    }
  ],
  "controllerMethodFilters": [
    {
      "exclude": "FilteredByAll$"
    }
  ],
  "customTypeMapping": {
    "Test.WebApi.Controllers.EntityName":"string"
  }
}